,Tweets,cleanedTweets
0,"When I was at UCSB I fought with the union recruiter because when I asked what strike fund, protections, negotiating power, or solidarity they offered I was told my questions meant I was anti-labor.","When I was at UCSB I fought with the union recruiter because when I asked what strike fund, protections, negotiating power, or solidarity they offered I was told my questions meant I was anti-labor."
1,@varsha_venkat_ I think union organizers did their best to make a long haul strike seem undesirable and suggest it wouldn't work. But I don't think it's an accident that UCSC and UCSB voted no when they have among the highest rent burden but were included in the lower pay scale., I think union organizers did their best to make a long haul strike seem undesirable and suggest it wouldn't work. But I don't think it's an accident that UCSC and UCSB voted no when they have among the highest rent burden but were included in the lower pay scale.
2,UCSC organizers on the ratified agreement that ends the strike. Only 20% of rank and file at SC voted for the contract (35% at UCSB; 27% at Merced). The struggle continues.,UCSC organizers on the ratified agreement that ends the strike. Only 20% of rank and file at SC voted for the contract (35% at UCSB; 27% at Merced). The struggle continues.
3,"People from Berkeley judging the strike at UCSB, while endorsing a contract that gives them more money and leaves us and UCSC behind even though cost of living in Santa Cruz and Santa Barbara is outrageously high.","People from Berkeley judging the strike at UCSB, while endorsing a contract that gives them more money and leaves us and UCSC behind even though cost of living in Santa Cruz and Santa Barbara is outrageously high."
4,"Quiet part out loud. The ""Vote No"" campaign (at least at UCSB) not only has no plan to expand the strike to win more if the TA is voted down, but they're actively telling people to vote no and not commit to *remaining* on strike. @janna_e_haider -- do you endorse this?","Quiet part out loud. The ""Vote No"" campaign (at least at UCSB) not only has no plan to expand the strike to win more if the TA is voted down, but they're actively telling people to vote no and not commit to *remaining* on strike.  -- do you endorse this?"
5,"The UCSB vote no campaign is stating clearly they have no plan to build power to win a better contract. Voting no while telling people they don’t have to build the strike is voting to sabotage all of your coworkers hard fought progress, and leave literally everyone behind. https://t.co/i4dcMjGKes","The UCSB vote no campaign is stating clearly they have no plan to build power to win a better contract. Voting no while telling people they don’t have to build the strike is voting to sabotage all of your coworkers hard fought progress, and leave literally everyone behind. "
6,"In this email to UCSB, “vote no” campaigner state clearly that they have no plan to build power to win a better contract. Let’s be clear: Voting no while telling people they don’t have to build the strike is voting to sabotage all of your coworkers hard fought progress. (1/2) https://t.co/BA4Z4ZHptO","In this email to UCSB, “vote no” campaigner state clearly that they have no plan to build power to win a better contract. Let’s be clear: Voting no while telling people they don’t have to build the strike is voting to sabotage all of your coworkers hard fought progress. (1/2) "
7,"FYI: Was at UCSB, took part in the 1998 walkout for our first contract, helped negotiate some of the first contract before the UCSB team walked out due to UAW asking us to give up the right to strike early on; the UCSB team disagreed... 1/2","FYI: Was at UCSB, took part in the 1998 walkout for our first contract, helped negotiate some of the first contract before the UCSB team walked out due to UAW asking us to give up the right to strike early on; the UCSB team disagreed... 1/2"
8,"""This disparity is based only on perceived 'prestige' – the cost of living on some of these campuses, like UCSC and UCSB, is higher than the cost of living at UCLA, UCB, and UCSF. This disparity in pay among campuses is clearly a tactic by the UC to break our strike…""","""This disparity is based only on perceived 'prestige' – the cost of living on some of these campuses, like UCSC and UCSB, is higher than the cost of living at UCLA, UCB, and UCSF. This disparity in pay among campuses is clearly a tactic by the UC to break our strike…"""
9,"A higher wage tier for Cal/LA/SF is based upon perceived prestige, not cost of living, and accepting that seems counterintuitive to the collective action of our strike. LA didn't strike harder than UCSC/UCSB/etc and they pay just as much (if not more) in rent","A higher wage tier for Cal/LA/SF is based upon perceived prestige, not cost of living, and accepting that seems counterintuitive to the collective action of our strike. LA didn't strike harder than UCSC/UCSB/etc and they pay just as much (if not more) in rent"
10,@ThomasDConnell @protostasis @jasonbuhle @culetilltheend @NelsonLichtens1 UCSB has been aligned with UCSC since COLA (we were the second campus to join the strike). All of our bargaining team members voted against this TA and every concession the BT has made so far.,     UCSB has been aligned with UCSC since COLA (we were the second campus to join the strike). All of our bargaining team members voted against this TA and every concession the BT has made so far.
11,@davidsirota Screenplay Written by blacklisted writer Michael Wilson whose daughter was a classmate of mine at UCSB in late 60’s. Wilson also wrote one of the most iconic films about  a Zinc miners strike called Salt of the Earth which Hollywood went all out to suppress., Screenplay Written by blacklisted writer Michael Wilson whose daughter was a classmate of mine at UCSB in late 60’s. Wilson also wrote one of the most iconic films about  a Zinc miners strike called Salt of the Earth which Hollywood went all out to suppress.
12,all the anti strike stuff on ucsb reddit reminds me that reddit is reddit,all the anti strike stuff on ucsb reddit reminds me that reddit is reddit
13,"UCSB ACADEMIC WORKER MUTUAL AID FUND

This fund will be used to support academic worker during the strike via grants &amp; purchasing supplies A group of student workers will transparently collect &amp; disperse funds. Monitored by the GSA venmo: UCSB-AW-mutual-aid",UCSB ACADEMIC WORKER MUTUAL AID FUND  This fund will be used to support academic worker during the strike via grants &amp; purchasing supplies A group of student workers will transparently collect &amp; disperse funds. Monitored by the GSA venmo: UCSB-AW-mutual-aid
14,Alt text: Photo of chalk art by Elings Hall at UCSB with ocean in the distance. Chalk art reads “UAW on strike for fair contracts.”,Alt text: Photo of chalk art by Elings Hall at UCSB with ocean in the distance. Chalk art reads “UAW on strike for fair contracts.”
15,#UCStrike #FairUCNow #StrikeToWin #BAMN #UC #strike #UniversityofCalifornia #DefendPublicEducation #UCLA #UCSD #UCSC #UCI #UCR #UCMerced #UCSB #UCBerkeley #UCSF #VoteNO Please share everywhere pdf: https://t.co/hIbN7w5hl7 https://t.co/fWliLccHQI,UCStrike FairUCNow StrikeToWin BAMN UC strike UniversityofCalifornia DefendPublicEducation UCLA UCSD UCSC UCI UCR UCMerced UCSB UCBerkeley UCSF VoteNO Please share everywhere pdf:  
16,"in case you missed it, check out this statement of solidarity with the strike from our friends at @ucsb_ftp. They do a great job situating the policing demands within the broader context of labor and social justice struggles   https://t.co/WcNLaDrgdX","in case you missed it, check out this statement of solidarity with the strike from our friends at . They do a great job situating the policing demands within the broader context of labor and social justice struggles   "
17,"watched someone at the UCSB strike rally open up his Twitter feat. a Lenin with red meme eyes profile pic and start drafting a happy birthday Engels tweet while ignoring everyone around him singing ""Solidarity Forever""","watched someone at the UCSB strike rally open up his Twitter feat. a Lenin with red meme eyes profile pic and start drafting a happy birthday Engels tweet while ignoring everyone around him singing ""Solidarity Forever"""
18,"The strike is the largest ever of higher-education academic workers - as graduate student workers call for better pay and benefits.

#UCSB #SantaBarbara #UCStrike UC Santa Barbara
https://t.co/bFxEsuTq6N",The strike is the largest ever of higher-education academic workers - as graduate student workers call for better pay and benefits.  UCSB SantaBarbara UCStrike UC Santa Barbara 
19,"Grad students are acting as cheaper adjuncts teaching sections of classes with far too many students enrolled. 

#ucsbstrike",Grad students are acting as cheaper adjuncts teaching sections of classes with far too many students enrolled.   ucsbstrike
20,UC Academic Workers Strike: Faculty Solidarity Rally at UCSB https://t.co/rjPiUaqbNX,UC Academic Workers Strike: Faculty Solidarity Rally at UCSB 
21,Faculty at UCSB in support of the UAW strike across the University of California. Faculty and grad workers UNITE!! Higher Ed Workers UNITE!! @HigherEdLabor @SFNDHE @ruaaup @ruaaup_ptl @uaw2865 @UAW @UAW5810 @sruuaw,Faculty at UCSB in support of the UAW strike across the University of California. Faculty and grad workers UNITE!! Higher Ed Workers UNITE!!        
22,UC Academic Workers Strike: Faculty Solidarity Rally at UCSB - The Santa Barbara Independent https://t.co/Vu2BgNb0cg,UC Academic Workers Strike: Faculty Solidarity Rally at UCSB - The Santa Barbara Independent 
23,"If u can get to a UC campus, join the picket lines starting Monday! See BAMN’s full statement here: https://t.co/FIlsNriPyT #ucstrike #striketowin #ucla #ucb #berkeley #ucd #ucsd #ucsb #ucsf #uci #strike #unions #uaw #unity #solidarity #picketlines #donotcross #bamn https://t.co/sOzoy9bbdL","If u can get to a UC campus, join the picket lines starting Monday! See BAMN’s full statement here:  ucstrike striketowin ucla ucb berkeley ucd ucsd ucsb ucsf uci strike unions uaw unity solidarity picketlines donotcross bamn "
24,"UC workers have been on strike since Nov. 14 with no end in sight. Stay up to date and fight with our UC workers! ✊🏿https://t.co/jgiFB5qLHx 
#UCStrikes #UCStrike #Cal #UCBerkeley #UCSystem #Strike #EducationStrike #UCSD #UCSB #UCR #UCM #UCLA #UCSC #Comrades",UC workers have been on strike since Nov. 14 with no end in sight. Stay up to date and fight with our UC workers! ✊🏿  UCStrikes UCStrike Cal UCBerkeley UCSystem Strike EducationStrike UCSD UCSB UCR UCM UCLA UCSC Comrades
25,"Tío Lobo asked me to tell ""el publico de el pajaro azul"" that as a 40+ year resident of Goleta, taxi driver, former Rusty's pizza delivery driver, cascara player (just outside Harder Stadium), and tio to a @UCSB PhD student (and two UCSB alum) he is 100% in support of strike.","Tío Lobo asked me to tell ""el publico de el pajaro azul"" that as a 40+ year resident of Goleta, taxi driver, former Rusty's pizza delivery driver, cascara player (just outside Harder Stadium), and tio to a  PhD student (and two UCSB alum) he is 100% in support of strike."
26,Thank you UCSB Film and Media Studies Faculty for unanimously supporting the strike #FairUCNow https://t.co/DWs5CxisrA,Thank you UCSB Film and Media Studies Faculty for unanimously supporting the strike FairUCNow 
27,"COLA (cost of living adjustment) is an important demand for UC academic workers.

It guarantees that our salary wins during this strike won’t be washed away by inflation and price increases.

It’s especially important for campuses like UCSB and UCSC where housing is a disaster.",COLA (cost of living adjustment) is an important demand for UC academic workers.  It guarantees that our salary wins during this strike won’t be washed away by inflation and price increases.  It’s especially important for campuses like UCSB and UCSC where housing is a disaster.
28,Last day of the Strike! #UCR #UC #UCSB #UCSF #UCSD https://t.co/zFbZUPiXoa,Last day of the Strike! UCR UC UCSB UCSF UCSD 
29,"Hey for everyone who came around to eat and join us today at UC Davis' Latitude and UCSB's DLG dining commons, thank you so much!!!! ✊🎉🌽🍇🎉🌽🎉

Let's imagine a new university! And go SPREAD THE STRIKE!!! WOOOHOO! 

@ucsb_ftp @UCDavis_COC","Hey for everyone who came around to eat and join us today at UC Davis' Latitude and UCSB's DLG dining commons, thank you so much!!!! ✊🎉🌽🍇🎉🌽🎉  Let's imagine a new university! And go SPREAD THE STRIKE!!! WOOOHOO!    "
30,"12
a Black badge reads in white lettering on its border: ""IN struggle, together! Solidarity! UCSB Rebellion! On Strike! COLA 4 ALL! Eat the regents"" in the center is a fierce but cute raccoon with its mouth open. Below in red lettering: ""Everything 4 everyone! Nothing 4 us!"" https://t.co/JzrEOTbxqr","12 a Black badge reads in white lettering on its border: ""IN struggle, together! Solidarity! UCSB Rebellion! On Strike! COLA 4 ALL! Eat the regents"" in the center is a fierce but cute raccoon with its mouth open. Below in red lettering: ""Everything 4 everyone! Nothing 4 us!"" "
31,"marching, teach-ins, chalking. all day every day. UCSB's strike for a fair contract is going strong and I'm so proud of fellow physics grads who are notable leaders among the STEM side of campus in efforts to remind the University, including our own PIs, of our value 😤💪 https://t.co/OYz0rsf56H","marching, teach-ins, chalking. all day every day. UCSB's strike for a fair contract is going strong and I'm so proud of fellow physics grads who are notable leaders among the STEM side of campus in efforts to remind the University, including our own PIs, of our value 😤💪 "
32,What the Bargaining Team does for the UAW strike and how the rank and file respond are going to set the tone for union actions for a long time. UCSB labor historian Nelson Lichtenstein writes about the strike and its potential influence here: https://t.co/EZJEUy1WMt  #UConStrike,What the Bargaining Team does for the UAW strike and how the rank and file respond are going to set the tone for union actions for a long time. UCSB labor historian Nelson Lichtenstein writes about the strike and its potential influence here:   UConStrike
33,"My son, Andy Knox, supporting the strike with reviews of various workers' anthems in a UCSB publication. #UCstrike","My son, Andy Knox, supporting the strike with reviews of various workers' anthems in a UCSB publication. UCstrike"
34,"Thousands of UC system graduate workers, postdocs, and faculty members have been on strike to demand a fair contract from the University of California. UC works because all of those graduate students, and postdoctoral workers do. #UCstrike #UCLA #UCR #UCSD #UCSB #UCIrvine https://t.co/zyuaDoReFL","Thousands of UC system graduate workers, postdocs, and faculty members have been on strike to demand a fair contract from the University of California. UC works because all of those graduate students, and postdoctoral workers do. UCstrike UCLA UCR UCSD UCSB UCIrvine "
35,my favorite ucsb strike chalk art today was all the variations of ways we could cook and eat the regents,my favorite ucsb strike chalk art today was all the variations of ways we could cook and eat the regents
36,"9 of 9 strike out  @GorrellClassic 
 @JonesUCSB @UCSB_Baseball @TopPreps @CoachMartinez7 @coachferg @Scout_JamesH  @JLeverton10 @mattharvey_32 @UCSDbsb @jgarcia147 @mbergandi  @coach_EZLACINA @CoachJT17 @PBR_Uncommitted @RyanOverland24 @CSUSMBaseball
@ArguellesRudy @JVina_2 https://t.co/deV5VApP5n",9 of 9 strike out                         
37,"8 strike outs. 8 of 8 @GorrellClassic 
 @JonesUCSB @UCSB_Baseball @TopPreps @CoachMartinez7 @coachferg @Scout_JamesH  @JLeverton10 @mattharvey_32 @UCSDbsb @jgarcia147 @mbergandi  @coach_EZLACINA @CoachJT17 @PBR_Uncommitted @RyanOverland24 @CSUSMBaseball
@ArguellesRudy @JVina_2 https://t.co/hMscpi5NPy",8 strike outs. 8 of 8                        
38,"8 strike outs. 7 of 8 @GorrellClassic 
 @JonesUCSB @UCSB_Baseball @TopPreps @CoachMartinez7 @coachferg @Scout_JamesH  @JLeverton10 @mattharvey_32 @UCSDbsb @jgarcia147 @mbergandi  @coach_EZLACINA @CoachJT17 @PBR_Uncommitted @RyanOverland24 @CSUSMBaseball
@ArguellesRudy @JVina_2 https://t.co/1NBD2iwaqa",8 strike outs. 7 of 8                        
39,"8 strike outs. 6 of 8 @GorrellClassic 
 @JonesUCSB @UCSB_Baseball @TopPreps @CoachMartinez7 @coachferg @Scout_JamesH  @JLeverton10 @mattharvey_32 @UCSDbsb @jgarcia147 @mbergandi  @coach_EZLACINA @CoachJT17 @PBR_Uncommitted @RyanOverland24 @CSUSMBaseball
@ArguellesRudy @JVina_2 https://t.co/jAMt0SXW9b",8 strike outs. 6 of 8                        
40,"8 strike outs. 5 of 8 @GorrellClassic 
 @JonesUCSB @UCSB_Baseball @TopPreps @CoachMartinez7 @coachferg @Scout_JamesH  @JLeverton10 @mattharvey_32 @UCSDbsb @jgarcia147 @mbergandi  @coach_EZLACINA @CoachJT17 @PBR_Uncommitted @RyanOverland24 @CSUSMBaseball
@ArguellesRudy @JVina_2 https://t.co/o3Zqkojwos",8 strike outs. 5 of 8                        
41,"8 strike outs. 4 of 8 @GorrellClassic 
 @JonesUCSB @UCSB_Baseball @TopPreps @CoachMartinez7 @coachferg @Scout_JamesH  @JLeverton10 @mattharvey_32 @UCSDbsb @jgarcia147 @mbergandi  @coach_EZLACINA @CoachJT17 @PBR_Uncommitted @RyanOverland24 @CSUSMBaseball
@ArguellesRudy @JVina_2 https://t.co/Cf9FB9LVBK",8 strike outs. 4 of 8                        
42,"8 strike outs. 3 of 8 @GorrellClassic 
 @JonesUCSB @UCSB_Baseball @TopPreps @CoachMartinez7 @coachferg @Scout_JamesH  @JLeverton10 @mattharvey_32 @UCSDbsb @jgarcia147 @mbergandi  @coach_EZLACINA @CoachJT17 @PBR_Uncommitted @RyanOverland24 @CSUSMBaseball
@ArguellesRudy @JVina_2 https://t.co/ObUC4rc5y5",8 strike outs. 3 of 8                        
43,"8 strike outs. 2 of 8 @GorrellClassic 
 @JonesUCSB @UCSB_Baseball @TopPreps @CoachMartinez7 @coachferg @Scout_JamesH  @JLeverton10 @mattharvey_32 @UCSDbsb @jgarcia147 @mbergandi  @coach_EZLACINA @CoachJT17 @PBR_Uncommitted @RyanOverland24 @CSUSMBaseball
@ArguellesRudy @JVina_2 https://t.co/KsDBLv10Kf",8 strike outs. 2 of 8                        
44,"8 strike outs. 1 of 8 @GorrellClassic 
 @JonesUCSB @UCSB_Baseball @TopPreps @CoachMartinez7 @coachferg @Scout_JamesH  @JLeverton10 @mattharvey_32 @UCSDbsb @jgarcia147 @mbergandi  @coach_EZLACINA @CoachJT17 @PBR_Uncommitted @RyanOverland24 @CSUSMBaseball
@ArguellesRudy @JVina_2 https://t.co/u4D886pPIm",8 strike outs. 1 of 8                        
45,"#ucsb just announced the end to university Covid testing. Because there is no tripledemic?? Grr. 

Use the saved money to pay your grad students? My daughters labs are canceled. I’m paying tuition for no courses and no safety. 

#madparents
#ucsbstrike",ucsb just announced the end to university Covid testing. Because there is no tripledemic?? Grr.   Use the saved money to pay your grad students? My daughters labs are canceled. I’m paying tuition for no courses and no safety.   madparents ucsbstrike
46,Speakers at Thursday’s rally say that classes and finals should not be held if they interfere with UCSB academic workers' strike. https://t.co/hMpBiKum7m,Speakers at Thursday’s rally say that classes and finals should not be held if they interfere with UCSB academic workers' strike. 
47,"UCSB Faculty Rally in Solidarity with Academic Workers on Strike
 https://t.co/2MEzteIAhX",UCSB Faculty Rally in Solidarity with Academic Workers on Strike  
48,"UCSB Faculty Rally in Solidarity with Academic Workers on Strike
 https://t.co/WloH6byAkE",UCSB Faculty Rally in Solidarity with Academic Workers on Strike  
49,"A group of academic employees, which includes research &amp; teaching assistants, went on strike this week across the University of California campuses. My photo was taken today on the UCSB campus. https://t.co/yVcQNftT4l","A group of academic employees, which includes research &amp; teaching assistants, went on strike this week across the University of California campuses. My photo was taken today on the UCSB campus. "
50,"Picketing at UCSB continued through the third day of the strike, with striking workers and supporters gathering under Storke Tower on the afternoon of Nov. 16 to hear from speakers and inform community members about the strike efforts. 
https://t.co/F2Nx4qI0tV","Picketing at UCSB continued through the third day of the strike, with striking workers and supporters gathering under Storke Tower on the afternoon of Nov. 16 to hear from speakers and inform community members about the strike efforts.  "
51,#UCstrike #California #UCLA #UCB #UCSD #UCI #UCR #UCSB #UCSF #labor #workers #strike #solidarity #unity #picket #defendpubliceducation #byanymeansnecessary #shutdownUC #striketowin https://t.co/NqxGJD0ydh,UCstrike California UCLA UCB UCSD UCI UCR UCSB UCSF labor workers strike solidarity unity picket defendpubliceducation byanymeansnecessary shutdownUC striketowin 
52,"really proud to share that a single email I sent has effectively caused a halt to all departmental Astro events in solidarity with the strike. so this is your reminder to not let anxiety win when you want to speak out. 💪
 #FairUCNow @uaw2865sb #UAWonStrike #UCSB https://t.co/50MjIQwRXL",really proud to share that a single email I sent has effectively caused a halt to all departmental Astro events in solidarity with the strike. so this is your reminder to not let anxiety win when you want to speak out. 💪  FairUCNow  UAWonStrike UCSB 
53,"To support UCSB specific grad students &amp; other academic workers, check out the academic worker mutual aid fund:

This fund will be used to support academic worker during the strike via grants &amp; purchasing supplies

venmo: UCSB-AW-mutual-aid https://t.co/Fpw059yTsW","To support UCSB specific grad students &amp; other academic workers, check out the academic worker mutual aid fund:  This fund will be used to support academic worker during the strike via grants &amp; purchasing supplies  venmo: UCSB-AW-mutual-aid "
54,"Academic workers at UC Riverside had the Strike at another level. Fair Contract for UC Academic Workers! 
@UCR @UCIrvine @UCberkely @UCLA @UCSB @UCdavis https://t.co/HkWW4nkcaU",Academic workers at UC Riverside had the Strike at another level. Fair Contract for UC Academic Workers!        
55,"@AndrewYang you are a sellout! 
You are not in solidarity with the underdogs! You are full of 💩
#UCIrvine #GradStudent #Workers #Strike #2022 #UCSD #UCR #UCLA #UCSC #UCSB #UCB #UCSF #UCB #UCD https://t.co/3ear07cPVr", you are a sellout!  You are not in solidarity with the underdogs! You are full of 💩 UCIrvine GradStudent Workers Strike 2022 UCSD UCR UCLA UCSC UCSB UCB UCSF UCB UCD 
56,"#UCSB is on strike! We demand a fair, livable wage ✊🏿✊🏾✊🏽✊🏻

We are more than 48,000 academic workers. This is the largest higher education strike in U.S. history, picketing at all UC campuses. #UnionStrong #UCStrike https://t.co/NzkfliXJ61","UCSB is on strike! We demand a fair, livable wage ✊🏿✊🏾✊🏽✊🏻  We are more than 48,000 academic workers. This is the largest higher education strike in U.S. history, picketing at all UC campuses. UnionStrong UCStrike "
57,There is a strike at my university (UCSB) and it is fucking up my classes :/,There is a strike at my university (UCSB) and it is fucking up my classes :/
58,"What do we want? #FairContracts
When do we want it? #FairUCNow!! 

We're on day 3 of strikes. #UCSB is making some noise 🔥🔥🔥

#unionstrong https://t.co/XsBBOACGFX",What do we want? FairContracts When do we want it? FairUCNow!!   We're on day 3 of strikes. UCSB is making some noise 🔥🔥🔥  unionstrong 
59,"I support the UC academic workers strike for many reasons but most recently bc when I reached out to financial aid crisis at UCSB where I am a grad, their solutions were 1- taking out loans, 2- applying for a grant that requires repayment &amp; 3- resources to literally feed myself https://t.co/5dkZd6nZ1p","I support the UC academic workers strike for many reasons but most recently bc when I reached out to financial aid crisis at UCSB where I am a grad, their solutions were 1- taking out loans, 2- applying for a grant that requires repayment &amp; 3- resources to literally feed myself "
60,Day 3 of the ULP strike for a #FairUCNow on the Santa Barbara campus! #UCSB #UAW2865 #SRUUAW #UAW5810 https://t.co/7xf74u5hjc,Day 3 of the ULP strike for a FairUCNow on the Santa Barbara campus! UCSB UAW2865 SRUUAW UAW5810 
61,Day 3 of the ULP strike for a #FairUCNow on the Santa Barbara campus! #UCSB #UAW2865 #SRUUAW #UAW5810 https://t.co/CQiKHgHRiP,Day 3 of the ULP strike for a FairUCNow on the Santa Barbara campus! UCSB UAW2865 SRUUAW UAW5810 
62,"I spent 13 years at UCSB as an undergraduate and a graduate student. I worked as a course grader in my undergrad days. I worked as a campus tutor and a teaching assistant when I was a grad student. We were paid a pittance.

I am in total solidarity with those on strike!",I spent 13 years at UCSB as an undergraduate and a graduate student. I worked as a course grader in my undergrad days. I worked as a campus tutor and a teaching assistant when I was a grad student. We were paid a pittance.  I am in total solidarity with those on strike!
63,"we join fellow historians at UCLA, UCSC, and UCSB in expressing our solidarity for the strikers, Nov 15,2022, day 2 of this strike #FairUCNow 
https://t.co/jvXPqkyIBa","we join fellow historians at UCLA, UCSC, and UCSB in expressing our solidarity for the strikers, Nov 15,2022, day 2 of this strike FairUCNow  "
64,Academic workers strike continues at #UCSB https://t.co/NV2CREp93C,Academic workers strike continues at UCSB 
