,Tweets,cleanedTweets
181,'Exceptional' first gen UCSB undergrad &amp; now UCSD PhD student here 😌 requesting that @UCPrezDrake @UCregentboard send someone with decision making power to the #UAW bargaining table. How do you expect to wait out students in 22nd grade 🤓 &amp; above? #UAWonStrike,'Exceptional' first gen UCSB undergrad &amp; now UCSD PhD student here 😌 requesting that   send someone with decision making power to the UAW bargaining table. How do you expect to wait out students in 22nd grade 🤓 &amp; above? UAWonStrike
182,"@mdpollak @HaroldMeyerson not propaganda, I was there... the UAW folks didn't understand the different material conditions between phys/nat sci and soc sci/hum, much less how different UCB, UCLA, &amp; UCSD were from UCI, UCSB, &amp; UCSC (w/ UCD somewhere in between) dunno if anything's been written in it.","  not propaganda, I was there... the UAW folks didn't understand the different material conditions between phys/nat sci and soc sci/hum, much less how different UCB, UCLA, &amp; UCSD were from UCI, UCSB, &amp; UCSC (w/ UCD somewhere in between) dunno if anything's been written in it."
183,What the Bargaining Team does for the UAW strike and how the rank and file respond are going to set the tone for union actions for a long time. UCSB labor historian Nelson Lichtenstein writes about the strike and its potential influence here: https://t.co/EZJEUy1WMt  #UConStrike,What the Bargaining Team does for the UAW strike and how the rank and file respond are going to set the tone for union actions for a long time. UCSB labor historian Nelson Lichtenstein writes about the strike and its potential influence here:   UConStrike
184,@SoCal_SD_Cat @nathanfletcher @UAW @UofCalifornia Our son is a sophomore at UCSB.,    Our son is a sophomore at UCSB.
185,I was a member of @uaw5180 for 4 years as a post doc @ucsb and helped organize academic researchers when we came together to unionize under the same @UAW affiliation. I don’t know how UC can continue to recruit grad students @uaw2865 when they pay so little. #unionpower,I was a member of  for 4 years as a post doc  and helped organize academic researchers when we came together to unionize under the same  affiliation. I don’t know how UC can continue to recruit grad students  when they pay so little. unionpower
186,"Solidarity to my comrades in Santa Barbara and all across CA 🖤 I was a UAW member during my time at UCSB and there is absolutely no way to make a sustainable living on the TA salary, even with subsidized housing in Goleta or IV #FairUCNow","Solidarity to my comrades in Santa Barbara and all across CA 🖤 I was a UAW member during my time at UCSB and there is absolutely no way to make a sustainable living on the TA salary, even with subsidized housing in Goleta or IV FairUCNow"
187,@ProfesoraLMO Almost 25 years ago I was cold calling people on UCSB's campus to encourage them to vote to unionize with the UAW. So glad to see that our efforts provided the foundation for today's students to fight for better working conditions., Almost 25 years ago I was cold calling people on UCSB's campus to encourage them to vote to unionize with the UAW. So glad to see that our efforts provided the foundation for today's students to fight for better working conditions.
188,#uaw on strike at #ucsb over #unfairlaborpractices https://t.co/zOQLkJ0WXh,uaw on strike at ucsb over unfairlaborpractices 
189,"@jeffguhin This is what our UCSB UAW union has decided constitutes respecting to picket line for senate faculty. There might be slightly different sugguestions if you’re at a different UC campus, but I’m guessing it would be fairly similar to this: https://t.co/tECUNuVaN1"," This is what our UCSB UAW union has decided constitutes respecting to picket line for senate faculty. There might be slightly different sugguestions if you’re at a different UC campus, but I’m guessing it would be fairly similar to this: "
190,UCSC organizers on the ratified agreement that ends the strike. Only 20% of rank and file at SC voted for the contract (35% at UCSB; 27% at Merced). The struggle continues.,UCSC organizers on the ratified agreement that ends the strike. Only 20% of rank and file at SC voted for the contract (35% at UCSB; 27% at Merced). The struggle continues.
191,"@JosephVanMatre @mzinshteyn @uaw2865 @sruuaw Read and research a little and you’ll understand why UCSB, UCSC and UC Merced feel hamstrung by our ratified agreement. See @NelsonLichtens1 et al. and https://t.co/qVlEiFK4Mx","    Read and research a little and you’ll understand why UCSB, UCSC and UC Merced feel hamstrung by our ratified agreement. See  et al. and "
192,"@realTuckFrumper I'm happy they've reached a tentative agreement. They've been fighting since I was a student over 30 years ago.

With Storke Tower in the background is my alma mater @ucsb. The most beautiful of all college campuses. GO GAUCHOS!!", I'm happy they've reached a tentative agreement. They've been fighting since I was a student over 30 years ago.  With Storke Tower in the background is my alma mater . The most beautiful of all college campuses. GO GAUCHOS!!
193,"Seasonal surge as #COVID-19 levels creep higher; tips for staying healthy through holiday mingles; #UCStrike UC, union negotiators reach agreement #SantaBarbara mom shares experience with long COVID.@as_ucsb #HappyHolidays from #KCSBNews https://t.co/1ePxv0n2rP","Seasonal surge as COVID-19 levels creep higher; tips for staying healthy through holiday mingles; UCStrike UC, union negotiators reach agreement SantaBarbara mom shares experience with long COVID. HappyHolidays from KCSBNews "
194,"So glad there is a tentative agreement, but definitely wondering why UCLA and UCBerkeley get more money than those at UCSB? I can't imagine housing is more expensive in LA than SB. I have multiple students (and I) live in LA and work at UCSB.","So glad there is a tentative agreement, but definitely wondering why UCLA and UCBerkeley get more money than those at UCSB? I can't imagine housing is more expensive in LA than SB. I have multiple students (and I) live in LA and work at UCSB."
195,"@COVIDSafeCampus There have been several events switching to virtual--but not cuz of the pandemic. Instead, it's cuz of grad students striking &amp; disrupting said events. UCSB suddenly cares about accessibility once the speaker can't get a word in because the university is treating workers poorly🤦🏽"," There have been several events switching to virtual--but not cuz of the pandemic. Instead, it's cuz of grad students striking &amp; disrupting said events. UCSB suddenly cares about accessibility once the speaker can't get a word in because the university is treating workers poorly🤦🏽"
196,"@CW_Lester @KITP_UCSB Ah! Yeah, this pattern is striking but I'm not sure it's from creep; could be livestock grazing? But @rachelglade might have a different take?","  Ah! Yeah, this pattern is striking but I'm not sure it's from creep; could be livestock grazing? But  might have a different take?"
197,Striking student workers are setting up camp for the night for a #StrikeAction at #UCSB #UAWonStrike #FairUCNow https://t.co/VHUF3Un2xV,Striking student workers are setting up camp for the night for a StrikeAction at UCSB UAWonStrike FairUCNow 
198,The grad students striking at UCSB sure are asking for a lot. #ucstrike https://t.co/ptsPfMnhCV,The grad students striking at UCSB sure are asking for a lot. ucstrike 
199,🏀 UCSB got out to a hot start and remained in striking distance of No. 15 UCLA into the final minutes of a terrific effort on Saturday night at the Thunderdome. https://t.co/ygsHUJjoXR,🏀 UCSB got out to a hot start and remained in striking distance of No. 15 UCLA into the final minutes of a terrific effort on Saturday night at the Thunderdome. 
200,"UCLA out scores UCSB 23–11 in the third quarter to take a 48-44 lead into the fourth. Gauchos still within striking distance, but Charisma Osborne is heating up for the Bruins and is up to 16 points.","UCLA out scores UCSB 23–11 in the third quarter to take a 48-44 lead into the fourth. Gauchos still within striking distance, but Charisma Osborne is heating up for the Bruins and is up to 16 points."
201,Striking overUnfair Labor Practices and for a Fair Contract ain't rocket science! #UAWonStrike #Week3 #FairContractNow #UConStrike and striking in paradise isn't so bad! #UCSB https://t.co/f2uR2uqwAo,Striking overUnfair Labor Practices and for a Fair Contract ain't rocket science! UAWonStrike Week3 FairContractNow UConStrike and striking in paradise isn't so bad! UCSB 
202,#FairUCNow terrible picture of a great solidarity march today with faculty for striking students #UCSB #ucstrike https://t.co/IbAVO1GeGZ,FairUCNow terrible picture of a great solidarity march today with faculty for striking students UCSB ucstrike 
203,"Picketing at UCSB continued through the third day of the strike, with striking workers and supporters gathering under Storke Tower on the afternoon of Nov. 16 to hear from speakers and inform community members about the strike efforts. 
https://t.co/F2Nx4qI0tV","Picketing at UCSB continued through the third day of the strike, with striking workers and supporters gathering under Storke Tower on the afternoon of Nov. 16 to hear from speakers and inform community members about the strike efforts.  "
204,"UCSB: Rally tomorrow at noon - all out for striking workers! We'll meet outside the SSMS building, march to the east campus picket line, and end with speakers and spoken word at the Arbor. https://t.co/lVfrY5zadW","UCSB: Rally tomorrow at noon - all out for striking workers! We'll meet outside the SSMS building, march to the east campus picket line, and end with speakers and spoken word at the Arbor. "
205,"“It's not the striking workers that are hurting undergraduates’ ability to learn. It is the university's refusal to pay workers enough,” said Charmaine Chua, a UCSB professor who halted her research in solidarity with the academic workers. 

From me and @GraceMayerr","“It's not the striking workers that are hurting undergraduates’ ability to learn. It is the university's refusal to pay workers enough,” said Charmaine Chua, a UCSB professor who halted her research in solidarity with the academic workers.   From me and "
206,Thank you @UCSB_Baseball for having me at the fall prospect camp. I had a great time learned a a lot and loved the campus. Ended up facing 5 batters and striking out 4. #Uncommitted @JonesUCSB @AWHS_Baseball_ @NorCalBlack https://t.co/1EXtNREbfb,Thank you  for having me at the fall prospect camp. I had a great time learned a a lot and loved the campus. Ended up facing 5 batters and striking out 4. Uncommitted    
207,Proud of those striking and supporting the strikers at my alma mater (UCSB)!!!,Proud of those striking and supporting the strikers at my alma mater (UCSB)!!!
208,"Hey today’s my birthday— if you feel like getting me something nice, you’d donate to the ucsb mutual aid fund to support our striking grad students","Hey today’s my birthday— if you feel like getting me something nice, you’d donate to the ucsb mutual aid fund to support our striking grad students"
209,Okay but the UCSB TAs striking and blasting Money Money Money by ABBA at their protest is camp,Okay but the UCSB TAs striking and blasting Money Money Money by ABBA at their protest is camp
210,"I finished graduate school at UCSB (and then worked as an adjunct) while living in a garage in Goleta, and I still have debt from those days. Solidarity forever with the striking workers! https://t.co/jC3C8M2dvr","I finished graduate school at UCSB (and then worked as an adjunct) while living in a garage in Goleta, and I still have debt from those days. Solidarity forever with the striking workers! "
211,"The ACGCC stands in solidarity with striking UC Academic Workers. For more info on the strike, see https://t.co/qNcDolnkKp https://t.co/q8ELPf3gnY","The ACGCC stands in solidarity with striking UC Academic Workers. For more info on the strike, see  "
212,"@JosephVanMatre @mzinshteyn @uaw2865 @sruuaw Read and research a little and you’ll understand why UCSB, UCSC and UC Merced feel hamstrung by our ratified agreement. See @NelsonLichtens1 et al. and https://t.co/qVlEiFK4Mx","    Read and research a little and you’ll understand why UCSB, UCSC and UC Merced feel hamstrung by our ratified agreement. See  et al. and "
213,"12 UC Research Breakthroughs in 2022
Our @UofCalifornia community is incredible! Click the link below to read about some of the pioneering research conducted by students and faculty this past year. 

https://t.co/kzTFje8l17

#ucb #ucd #uci #ucla #merced #ucsd #ucsf #ucsb #ucsc https://t.co/TVrx1Copej",12 UC Research Breakthroughs in 2022 Our  community is incredible! Click the link below to read about some of the pioneering research conducted by students and faculty this past year.     ucb ucd uci ucla merced ucsd ucsf ucsb ucsc 
214,"@dyslexiamama Google almost any university in so Cal, look at their course descriptions etc. UCLA, UCI &amp; UCSB all still have them available online dating back 20yrs. Heck. E Hanford just tweeted a link to a podcast by a ucla prof with her book/research from 2008. I’m not making shit up lol"," Google almost any university in so Cal, look at their course descriptions etc. UCLA, UCI &amp; UCSB all still have them available online dating back 20yrs. Heck. E Hanford just tweeted a link to a podcast by a ucla prof with her book/research from 2008. I’m not making shit up lol"
215,"THREAD: This year, #UCSB achieved major milestones and carried out impactful scholarly research. Discover the five most-read stories of 2022. (1/6) https://t.co/LyKqEtP76n","THREAD: This year, UCSB achieved major milestones and carried out impactful scholarly research. Discover the five most-read stories of 2022. (1/6) "
216,Today marks my last day in the UCSB SecLab 🏄. It was crazy fun to spend a sabbatical in one of the most amazing security groups. I learned a lot about research and with these impressions I'll head home to the @HexHiveEPFL 🐝. Santa Barbara and the SecLab will remain in my ❤️ 🤙 https://t.co/nERX4eXIWY,Today marks my last day in the UCSB SecLab 🏄. It was crazy fun to spend a sabbatical in one of the most amazing security groups. I learned a lot about research and with these impressions I'll head home to the  🐝. Santa Barbara and the SecLab will remain in my ❤️ 🤙 
217,"""Research and analysis weighed by this Panel reveal significant health and safety risks that are predictable enough, probable enough, and consequential enough that it would be unwise for UCSB to proceed without significant modifications to the design.""","""Research and analysis weighed by this Panel reveal significant health and safety risks that are predictable enough, probable enough, and consequential enough that it would be unwise for UCSB to proceed without significant modifications to the design."""
218,"Our presenter today is Dr. Raffael Jovine. He studied biophysics and biochemistry at Yale, did his PhD in marine sciences at UCSB &amp; did research at MIT. In 2013 he founded Brilliant Planet","Our presenter today is Dr. Raffael Jovine. He studied biophysics and biochemistry at Yale, did his PhD in marine sciences at UCSB &amp; did research at MIT. In 2013 he founded Brilliant Planet"
219,"Here’s another misinfo pamphlet posted in UCSB that will get you kicked out of gradschool if you do it in research. Srsly, please retake stats class. https://t.co/btFB5Wdedr","Here’s another misinfo pamphlet posted in UCSB that will get you kicked out of gradschool if you do it in research. Srsly, please retake stats class. "
220,"For today’s 28 Tigers celebration, we’re featuring @heidiaminhong🫡—Assistant Professor of English at UCSB—one of Kaya's past research assistants!

🚨 Become a Kaya Tiger today and help us reach our fundraising goal of $30,000 by Jan 1! 🚨 Donate here: https://t.co/26Hs1rLcr1 https://t.co/SWEzbI8lGf","For today’s 28 Tigers celebration, we’re featuring 🫡—Assistant Professor of English at UCSB—one of Kaya's past research assistants!  🚨 Become a Kaya Tiger today and help us reach our fundraising goal of $30,000 by Jan 1! 🚨 Donate here:  "
221,"The regents of @ucsantabarbara, @NChemaya and @Kiteleod, received a grant to host weekly seminars on DeFi research hosted by UCSB

Their goal is to create a community focused on DeFi and DEX focused academic research","The regents of ,  and , received a grant to host weekly seminars on DeFi research hosted by UCSB  Their goal is to create a community focused on DeFi and DEX focused academic research"
222,"@MichaelPErb @EuroGeosciences @yaskondo @CHIKYUKEN @RIHN_OpenTS @SoilsandSwamps @txstategeo @leahpmarshall @nau_ses @bradley_markle @INSTAAR @CUBoulder @JuneauIcefield @Caltech @UCSB @UW @WellingtonUni @pomonacollege @suzie_birch https://t.co/wjD2s7JMFm
1 OF 140 RESEARCH 🧐
@trowelblazers @openquaternary @AnabelleCas
@EtnoBA @AliceRPaine @OxUniEarthSci @ERC_Research @PoppyHarding @Stable_Planet
@TommasiniAugus1 @archaeolydia @KU_Leuven @ArchaeologyNCL @marleenvanz @elliebroadman
@TreeRingLabUA @UCBerkeley",                    1 OF 140 RESEARCH 🧐                 
223,@saigrundy UCSB has no annual research funds after startup 😭 Not sure about the other UCs, UCSB has no annual research funds after startup 😭 Not sure about the other UCs
224,Congratulations to UCSB NLP’s Anisha Kabir winning the Honorable Mention of 2023 CRA’s Outstanding Undergraduate Researcher Award. Anisha is recognized for her research on summarization and AI safety. Anisha is the 8th student from our lab being recognized by the CRA! #NLProc 🎉 https://t.co/p58pYZt3Xl,Congratulations to UCSB NLP’s Anisha Kabir winning the Honorable Mention of 2023 CRA’s Outstanding Undergraduate Researcher Award. Anisha is recognized for her research on summarization and AI safety. Anisha is the 8th student from our lab being recognized by the CRA! NLProc 🎉 
225,@andreagail_k @GrahamAllen_1 @RepSwalwell You cannot deny actual facts.  That research study from UCSB is true. Joe Biden is a lying scumbag.  You try to conflate the truth with bs.  You are a pedo protecting Democrat.  You spin lies.  Every one can see that.,   You cannot deny actual facts.  That research study from UCSB is true. Joe Biden is a lying scumbag.  You try to conflate the truth with bs.  You are a pedo protecting Democrat.  You spin lies.  Every one can see that.
226,"@Adam_C_Garber @IMMERSE_UCSB additionally, i'm particularly interested in research that identifies strengths and resources, rather than research that focuses on risks and deficits, particularly individualised deficits.","  additionally, i'm particularly interested in research that identifies strengths and resources, rather than research that focuses on risks and deficits, particularly individualised deficits."
227,"💡Article spotlight! Do you know any applications of #LCA which investigate novel substantive Qs in #diversity/#equity/#inclusion research?

""A latent class analysis of health behavior changes after cancer diagnosis among Hispanic/Latino cancer survivors""

https://t.co/1VaAI7RSJx","💡Article spotlight! Do you know any applications of LCA which investigate novel substantive Qs in diversity/equity/inclusion research?  ""A latent class analysis of health behavior changes after cancer diagnosis among Hispanic/Latino cancer survivors""  "
228,"Researchers at #UCSB assess how Kellet's whelk larva will cope with environmental changes – and what it means for #ecosystems and #fisheries. 

Read the article via @ucsantabarbara: https://t.co/YlFLZGMRvm
Read the research in BioOne Complete: https://t.co/xju9eUGakG https://t.co/n3oF9kEUyi",Researchers at UCSB assess how Kellet's whelk larva will cope with environmental changes – and what it means for ecosystems and fisheries.   Read the article via :  Read the research in BioOne Complete:  
229,can someone pls tell me what its like being a research assistant for a prof @ ucsb T___T I FEEL LIKE HIS LIL BITCH IS THIS NORMAL,can someone pls tell me what its like being a research assistant for a prof @ ucsb T___T I FEEL LIKE HIS LIL BITCH IS THIS NORMAL
230,"Research note of UCSB faculty colleague, Prof. D. Masterson:

Masterson D (2022) University of California PhD pay is among the lowest in the U.S. after accounting for cost of living, Nov. 29, 2022; pp 1-22

https://t.co/qMtog1EYE2.  😩","Research note of UCSB faculty colleague, Prof. D. Masterson:  Masterson D (2022) University of California PhD pay is among the lowest in the U.S. after accounting for cost of living, Nov. 29, 2022; pp 1-22    😩"
231,"@alextwenzel I agree it’s not right. But the converse is already true. At UCSB a friend was on a fellowship and made &gt;$30,000/yr while I made $22,000/yr &amp;had to TA. I worked more hours to keep up in research but was paid less. Everyone deserves more tho. So I do agree with you!"," I agree it’s not right. But the converse is already true. At UCSB a friend was on a fellowship and made &gt;$30,000/yr while I made $22,000/yr &amp;had to TA. I worked more hours to keep up in research but was paid less. Everyone deserves more tho. So I do agree with you!"
232,"Interested in data science, remote sensing, &amp; climate change research? We are hiring up to 2 data scientists to work on projects investigating the global impacts of #climatechange on human wellbeing. Apply by 1/4: https://t.co/UATfoBs6Vt UCSB is an EOE, including disability/vets.","Interested in data science, remote sensing, &amp; climate change research? We are hiring up to 2 data scientists to work on projects investigating the global impacts of climatechange on human wellbeing. Apply by 1/4:  UCSB is an EOE, including disability/vets."
233,"Insight &amp; Influence
Ten @ucsantabarbara researchers have been named among the most influential scientists in the world! Click the link below to read about some of the amazing research conducted by the #UCSB faculty! @UCSB_Alumni 

https://t.co/1oyVet8ALx",Insight &amp; Influence Ten  researchers have been named among the most influential scientists in the world! Click the link below to read about some of the amazing research conducted by the UCSB faculty!    
234,"(2)

It connected four computer network nodes at the University of California, Los Angeles, (U.C.L.A.), the Stanford Research Institute (S.R.I.) in Menlo Park, Calif., U.C. Santa Barbara (UCSB), and the University of Utah. https://t.co/bW5eIxZd7j","(2)  It connected four computer network nodes at the University of California, Los Angeles, (U.C.L.A.), the Stanford Research Institute (S.R.I.) in Menlo Park, Calif., U.C. Santa Barbara (UCSB), and the University of Utah. "
235,"This Week in The Current: Catch up on the latest research news from #UCSB.

#research #news #ResearchNews https://t.co/Ad8IWtVMGt",This Week in The Current: Catch up on the latest research news from UCSB.  research news ResearchNews 
236,@XtlStruc @UCSB_chemistry @Forbes Also did UG research with @echemkim,   Also did UG research with 
237,"Watch out for woodrats, if they're nearby, there's a chance ticks with Lyme disease are, too.  We get details on California research from UCSB scientists... https://t.co/tmBY7RRzec","Watch out for woodrats, if they're nearby, there's a chance ticks with Lyme disease are, too.  We get details on California research from UCSB scientists... "
238,"#DYK UC Santa Barbara has seven natural reserves dedicated to research and education? Part of the #UCSB Natural Reserve System, Sedgwick Reserve features 6,000 acres of beautiful open space for all nature lovers. https://t.co/h14buTAOUh","DYK UC Santa Barbara has seven natural reserves dedicated to research and education? Part of the UCSB Natural Reserve System, Sedgwick Reserve features 6,000 acres of beautiful open space for all nature lovers. "
239,"New research finds that the more ♥’s people got when retweeting negative fake news, the more they agreed with the content — and hated the (fake) politician.
 
[Thanks to @UCSB's The Current for covering our research recently published in JoC!]

https://t.co/9Xq7lK8OI8 https://t.co/1Xo5E8zIPv","New research finds that the more ♥’s people got when retweeting negative fake news, the more they agreed with the content — and hated the (fake) politician.   [Thanks to 's The Current for covering our research recently published in JoC!]   "
240,"On Nov. 5, CCS hosted its annual Research and Creative Activities Conference (RACA-CON) where CCS students presented talks and posters about their research and creative projects. Congratulations to all RACA-CON presenters! Learn more: https://t.co/IQD3593dER https://t.co/SSAhqdjX64","On Nov. 5, CCS hosted its annual Research and Creative Activities Conference (RACA-CON) where CCS students presented talks and posters about their research and creative projects. Congratulations to all RACA-CON presenters! Learn more:  "
241,"Have you published research which applies mixture modeling to issues of #diversity, #equity, or #inclusion?

✨Each week we will use the @IMMERSE_UCSB platform to promote the work of exceptional scholars in our field who have applied latent class, profile, or transition analysis.","Have you published research which applies mixture modeling to issues of diversity, equity, or inclusion?  ✨Each week we will use the  platform to promote the work of exceptional scholars in our field who have applied latent class, profile, or transition analysis."
